<?xml version="1.0" encoding="UTF-8"?>
<xs:schema 
xmlns:xs="http://www.w3.org/2001/XMLSchema" 
xmlns:pc="http://www.czadzik.pl/parametersConfigurator" 
targetNamespace="http://www.czadzik.pl/parametersConfigurator" 
elementFormDefault="qualified">

<xs:element name="ParametersConfigurator" type="pc:ParametersConfiguratorType">
</xs:element>

<xs:complexType name="ParametersConfiguratorType">
	<xs:sequence>
		<xs:element name="ParametersConfiguratorTitle"			type="xs:string" minOccurs="1" maxOccurs="1"/>
		<xs:element name="ParametersConfiguratorIntroduction"	type="xs:string" minOccurs="0" maxOccurs="1"/>
		<xs:element name="Sections"								type="pc:SectionsType" minOccurs="0" maxOccurs="1">
			<xs:unique name="uniqueNameConstrain">
				<xs:selector xpath=".//*"/>
				<xs:field xpath="pc:Name"/>
			</xs:unique>
		</xs:element>
		<xs:element name="CorrectnessConditions" 				type="pc:ConditionalSectionType" minOccurs="0" maxOccurs="1"/>
		<xs:element name="GlobalSignsOfSet"						type="pc:SignsOfSetType" minOccurs="0" maxOccurs="1"/>
		<xs:element name="ParametersConfiguratorSummary"		type="xs:string" minOccurs="0" maxOccurs="1" />
	</xs:sequence>
	<xs:attribute name="additionalParameters" use="optional" type="xs:boolean" default="false" />
</xs:complexType>

<xs:complexType name="SectionsType">
	<xs:choice minOccurs="1" maxOccurs="unbounded" >
		<xs:element name="Section" type="pc:SectionType" />
	</xs:choice>
</xs:complexType>

<xs:complexType name="SectionType">
	<xs:sequence minOccurs="1" maxOccurs="1">
		<xs:element name="Parameters"			type="pc:ParametersType"	minOccurs="1" maxOccurs="1" />
		<xs:element name="VisibilityCondition"	type="pc:ConditionType"		minOccurs="0" maxOccurs="1"/>
	</xs:sequence>
</xs:complexType>

<xs:complexType name="ParametersType">
	<xs:choice minOccurs="1" maxOccurs="unbounded" >
		<xs:element name="BooleanParameter" 	type="pc:ParameterType"				minOccurs="0" maxOccurs="1" />
		<xs:element name="IntegerParameter" 	type="pc:IntegerParameterType" 		minOccurs="0" maxOccurs="1" />
		<xs:element name="FloatParameter" 		type="pc:FloatParameterType" 		minOccurs="0" maxOccurs="1" />
		<xs:element name="EnumerationParameter"	type="pc:EnumerationParameterType"	minOccurs="0" maxOccurs="1" />
		<xs:element name="TextParameter" 		type="pc:TextParameterType" 		minOccurs="0" maxOccurs="1" />
		<xs:element name="DateTimeParameter" 	type="pc:DateTimeParameterType" 	minOccurs="0" maxOccurs="1" />
		<xs:element name="DateParameter" 		type="pc:DateParameterType" 		minOccurs="0" maxOccurs="1" />
	</xs:choice>
</xs:complexType>

<xs:complexType name="ParameterType">
	<xs:sequence minOccurs="1" maxOccurs="1">
		<xs:element name="Name"			type="xs:string" minOccurs="1" maxOccurs="1" />
		<xs:element name="Label"		type="xs:string" minOccurs="0" maxOccurs="1" />
		<xs:element name="Description"	type="xs:string" minOccurs="0" maxOccurs="1" />
		<xs:element name="SignsOfSet"	type="pc:SignsOfSetType"	minOccurs="0" maxOccurs="1" />
		<xs:element name="Sections"		type="pc:SectionsType"		minOccurs="0" maxOccurs="1"/>
	</xs:sequence>
	<xs:attribute name="optional"			use="optional" type="xs:boolean" 			default="false" />
	<xs:attribute name="minNumberOfValues"	use="optional" type="xs:nonNegativeInteger"	default="1"/>
	<xs:attribute name="maxNumberOfValues"	use="optional" type="xs:positiveInteger"	default="1"/>
</xs:complexType>

<xs:complexType name="IntegerParameterType">
	<xs:complexContent>
		<xs:extension base="pc:ParameterType">
			<xs:sequence>
				<xs:element name="MinValue"		type="xs:integer" minOccurs="0" maxOccurs="1" />
				<xs:element name="MaxValue" 	type="xs:integer" minOccurs="0" maxOccurs="1" />
			</xs:sequence>
		</xs:extension>
	</xs:complexContent>
</xs:complexType>

<xs:complexType name="FloatParameterType">
	<xs:complexContent>
		<xs:extension base="pc:ParameterType">
			<xs:sequence>
				<xs:element name="MinValue" type="xs:double" minOccurs="0" maxOccurs="1" />
				<xs:element name="MaxValue" type="xs:double" minOccurs="0" maxOccurs="1" />
			</xs:sequence>
		</xs:extension>
	</xs:complexContent>
</xs:complexType>

<xs:complexType name="TextParameterType">
	<xs:complexContent>
		<xs:extension base="pc:ParameterType">
			<xs:sequence>
				<xs:element name="RegularExpression" type="xs:string" minOccurs="0" maxOccurs="1" />
			</xs:sequence>
		</xs:extension>
	</xs:complexContent>
</xs:complexType>

<xs:complexType name="DateTimeParameterType">
	<xs:complexContent>
		<xs:extension base="pc:ParameterType">
			<xs:sequence>
				<xs:element name="MinValue" type="xs:dateTime" minOccurs="0" maxOccurs="1" />
				<xs:element name="MaxValue" type="xs:dateTime" minOccurs="0" maxOccurs="1" />
			</xs:sequence>
		</xs:extension>
	</xs:complexContent>
</xs:complexType>

<xs:complexType name="DateParameterType">
	<xs:complexContent>
		<xs:extension base="pc:ParameterType">
			<xs:sequence>
				<xs:element name="MinValue" type="xs:date" minOccurs="0" maxOccurs="1" />
				<xs:element name="MaxValue" type="xs:date" minOccurs="0" maxOccurs="1" />
			</xs:sequence>
		</xs:extension>
	</xs:complexContent>
</xs:complexType>

<xs:complexType name="EnumerationParameterType">
	<xs:complexContent>
		<xs:extension base="pc:ParameterType">
			<xs:sequence minOccurs="1" maxOccurs="1">
				<xs:element name="EnumerationList" type="pc:EnumerationListType"/>
			</xs:sequence>
		</xs:extension>
	</xs:complexContent>
</xs:complexType>

<xs:complexType name="EnumerationListType">
	<xs:choice minOccurs="1" maxOccurs="unbounded">
		<xs:element name="Item" type="xs:string" />
	</xs:choice>
</xs:complexType>

<xs:complexType name="ConditionsType">
	<xs:choice minOccurs="1" maxOccurs="2">
		<xs:element name="ConditionalSection" type="pc:ConditionalSectionType" minOccurs="1" maxOccurs="unbounded"/>
		<xs:element name="Condition" type="pc:ConditionType" minOccurs="1" maxOccurs="unbounded"/>
	</xs:choice>
</xs:complexType>

<xs:complexType name="ConditionalSectionType">
	<xs:choice minOccurs="1" maxOccurs="2">
		<xs:element name="ConditionalSection" type="pc:ConditionalSectionType" minOccurs="1" maxOccurs="unbounded"/>
		<xs:element name="Condition" type="pc:ConditionType" minOccurs="1" maxOccurs="unbounded"/>
	</xs:choice>
	<xs:attribute name="logicalConnector" use="optional" default="AND">
		<xs:simpleType>
			<xs:restriction base="xs:string">
				<xs:enumeration value="AND" />
				<xs:enumeration value="OR" />
			</xs:restriction>
		</xs:simpleType>
	</xs:attribute>
</xs:complexType>


<xs:complexType name="BeginingOfConditionType">
	<xs:sequence>
		<xs:element name="FirstParameterName" type="xs:string" />
		<xs:element name="Clause">
			<xs:simpleType>
				<xs:restriction base="xs:string">
					<xs:enumeration value="EqualTo" />
					<xs:enumeration value="eq" />
					<xs:enumeration value="==" />
					<xs:enumeration value="NotEqualTo" />
					<xs:enumeration value="ne" />
					<xs:enumeration value="!=" />
					<xs:enumeration value="GreaterThan" />
					<xs:enumeration value="gt" />
					<xs:enumeration value=">" />
					<xs:enumeration value="GreaterOrEqual" />
					<xs:enumeration value="ge" />
					<xs:enumeration value=">=" />
					<xs:enumeration value="LessThan" />
					<xs:enumeration value="lt" />
					<xs:enumeration value="&lt;" />
					<xs:enumeration value="LessOrEqual" />
					<xs:enumeration value="le" />
					<xs:enumeration value="&lt;=" />
					<xs:enumeration value="IsSubset" />
					<xs:enumeration value="EmptyIntersection" />
					<xs:enumeration value="NotEmptyIntersection" />
				</xs:restriction>
			</xs:simpleType>
		</xs:element>
	</xs:sequence>
</xs:complexType>

<xs:complexType name="ConditionType">
	<xs:complexContent>
		<xs:extension base="pc:BeginingOfConditionType">
			<xs:choice minOccurs="1" maxOccurs="1" >
				<xs:element name="Value"				type="xs:string" />
				<xs:element name="SecondParameterName"	type="xs:string" />
				<xs:element name="Set" 					type="pc:EnumerationListType" />
			</xs:choice>
		</xs:extension>
	</xs:complexContent>
</xs:complexType>

<xs:complexType name="SignsOfSetType">
	<xs:sequence minOccurs="1" maxOccurs="1">
		<xs:element name="BeginningSign"	type="xs:string"/>
		<xs:element name="SeparatingSign"	type="xs:string"/>
		<xs:element name="EndingSign"		type="xs:string"/>
	</xs:sequence>
</xs:complexType>

</xs:schema>