<?xml version="1.0" encoding="UTF-8"?>

<pc:ParametersConfigurator
	xmlns:pc="http://www.czadzik.pl/parametersConfigurator" xmlns:xsi="http://www.w3.org/2001/XMLSchema-instance"
	xsi:schemaLocation="http://www.czadzik.pl/parametersConfigurator ../parametersConfigurator.xsd">

	<pc:ParametersConfiguratorTitle>Date parameter example</pc:ParametersConfiguratorTitle>
	<pc:ParametersConfiguratorIntroduction>
Introduction
Lorem ipsum dolor sit amet, consectetur adipiscing elit, sed do eiusmod tempor incididunt ut labore et dolore magna aliqua. Ut enim ad miur. Excepteur sint occaecat cupidatat non proident, sunt in culpa qui officia deseru
</pc:ParametersConfiguratorIntroduction>
	<pc:Sections>
		<pc:Section>
			<pc:Parameters>
				<pc:DateTimeParameter>
					<pc:Name>dateNumber</pc:Name>
					<pc:Label>Parametr datowy</pc:Label>
					<pc:MinValue>1980-01-01T00:01:34.5689745</pc:MinValue>
				</pc:DateTimeParameter>
				<pc:DateTimeParameter>
					<pc:Name>day</pc:Name>
					<pc:Label>Dzie≈Ñ</pc:Label>
					<pc:MinValue>1980-01-01T00:00:00</pc:MinValue>
					<pc:MaxValue>1980-01-01T23:59:59</pc:MaxValue>
				</pc:DateTimeParameter>
			</pc:Parameters>
		</pc:Section>
	</pc:Sections>
<pc:CorrectnessConditions>
	<pc:Condition>
		 <pc:FirstParameterName>dateNumber</pc:FirstParameterName>
		 <pc:Clause>LessThan</pc:Clause>
		 <pc:Value>1980-01-01T12:00:00</pc:Value>
	</pc:Condition>
</pc:CorrectnessConditions>

	<pc:ParametersConfiguratorSummary>
Summary
Lorem ipsum dolor sit amet, consectetur adipiscing elit, sed do eiusmod tempor incididunt ut labore et dolore magna aliqua. Ut enim ad minim veniam, quis nostrud exercitation ullamco laboris nisi ut aliquip ex ea commodo
</pc:ParametersConfiguratorSummary>
</pc:ParametersConfigurator>