<?xml version="1.0" encoding="UTF-8"?>

<pc:ParametersConfigurator
	xmlns:pc="http://www.czadzik.pl/parametersConfigurator" xmlns:xsi="http://www.w3.org/2001/XMLSchema-instance"
	xsi:schemaLocation="http://www.czadzik.pl/parametersConfigurator ../parametersConfigurator.xsd">

	<pc:ParametersConfiguratorTitle>Enum example</pc:ParametersConfiguratorTitle>
	<pc:ParametersConfiguratorIntroduction>
Introduction
Lorem ipsum dolor sit amet, consectetur adipiscing elit, sed do eiusmod tempor incididunt ut labore et dolore magna aliqua. Ut enim ad miur. Excepteur sint occaecat cupidatat non proident, sunt in culpa qui officia deseru
</pc:ParametersConfiguratorIntroduction>
	<pc:Sections>
		<pc:Section>
			<pc:Parameters>
				<pc:EnumerationParameter optional="true" maxNumberOfValues="3">
					<pc:Name>enumParameter</pc:Name>
					<pc:Label>Parametr wyliczeniowy</pc:Label>
					<pc:EnumerationList>
						<pc:Item>ABC</pc:Item>
						<pc:Item>BCD</pc:Item>
						<pc:Item>CDE</pc:Item>
						<pc:Item>DEF</pc:Item>
						<pc:Item>EFG</pc:Item>
						<pc:Item></pc:Item>
						<pc:Item>GHI</pc:Item>
					</pc:EnumerationList>
				</pc:EnumerationParameter>
			</pc:Parameters>
		</pc:Section>
	</pc:Sections>


	<pc:ParametersConfiguratorSummary>
Summary
Lorem ipsum dolor sit amet, consectetur adipiscing elit, sed do eiusmod tempor incididunt ut labore et dolore magna aliqua. Ut enim ad minim veniam, quis nostrud exercitation ullamco laboris nisi ut aliquip ex ea commodo
</pc:ParametersConfiguratorSummary>
</pc:ParametersConfigurator>