<?xml version="1.0" encoding="UTF-8"?>

<pc:ParametersConfigurator
	xmlns:pc="http://www.czadzik.pl/parametersConfigurator" xmlns:xsi="http://www.w3.org/2001/XMLSchema-instance"
	xsi:schemaLocation="http://www.czadzik.pl/parametersConfigurator ../parametersConfigurator.xsd">

	<pc:ParametersConfiguratorTitle>No introduction example</pc:ParametersConfiguratorTitle>
	<pc:Sections>
		<pc:Section>
			<pc:Parameters>
				<pc:EnumerationParameter optional="true">
					<pc:Name>enumParameter</pc:Name>
					<pc:Label>Parametr wyliczeniowy</pc:Label>
					<pc:Description>Długi opis. Długi opis. Długi opis. Długi opis. Długi opis. Długi opis. Długi opis. Długi opis. Długi opis. Długi opis. Długi opis. Długi opis. Długi opis.</pc:Description>
					<pc:EnumerationList>
						<pc:Item>A</pc:Item>
						<pc:Item>B</pc:Item>
						<pc:Item>C</pc:Item>
					</pc:EnumerationList>
				</pc:EnumerationParameter>
				<pc:TextParameter>
					<pc:Name>textParameter2</pc:Name>
					<pc:Label>Parametr tekstowy</pc:Label>
					<pc:Description>Długi opis. Długi opis. Długi opis. Długi opis. Długi opis. Długi opis. 
					Długi opis. Długi opis. Długi opis. Długi opis. Długi opis. Długi opis. Długi opis.</pc:Description>
					<pc:RegularExpression>^[a-zA-Z0-9]+$</pc:RegularExpression>
				</pc:TextParameter>
				<pc:IntegerParameter>
					<pc:Name>intNumber</pc:Name>
					<pc:Label>Liczba całkowita</pc:Label>
					<pc:Description>Długi opis. Długi opis. Długi opis. Długi opis. Długi opis. Długi opis. 
					Długi opis. Długi opis. Długi opis. Długi opis. Długi opis. Długi opis. Długi opis.</pc:Description>
				</pc:IntegerParameter>
				<pc:FloatParameter>
					<pc:Name>floatNumber</pc:Name>
					<pc:Label>Liczba zmiennoprzecinkowa</pc:Label>
					<pc:Description>Długi opis. Długi opis. Długi opis. Długi opis. Długi opis. Długi opis. 
					Długi opis. Długi opis. Długi opis. Długi opis. Długi opis. Długi opis. Długi opis.</pc:Description>
					<pc:MinValue>0.5</pc:MinValue>
					<pc:MaxValue>10</pc:MaxValue>
				</pc:FloatParameter>
				<pc:EnumerationParameter optional="true">
					<pc:Name>enumParameter2</pc:Name>
					<pc:Label>Parametr wyliczeniowy</pc:Label>
					<pc:Description>Długi opis. Długi opis. Długi opis. Długi opis. Długi opis. Długi opis. Długi opis. Długi opis. Długi opis. Długi opis. Długi opis. Długi opis. Długi opis.</pc:Description>
					<pc:EnumerationList>
						<pc:Item>A</pc:Item>
						<pc:Item>B</pc:Item>
						<pc:Item>C</pc:Item>
					</pc:EnumerationList>
				</pc:EnumerationParameter>
				<pc:TextParameter>
					<pc:Name>textParameter23</pc:Name>
					<pc:Label>Parametr tekstowy</pc:Label>
					<pc:Description>Długi opis. Długi opis. Długi opis. Długi opis. Długi opis. Długi opis. Długi opis. Długi opis. Długi opis. Długi opis. Długi opis. Długi opis. Długi opis.</pc:Description>
					<pc:RegularExpression>*</pc:RegularExpression>
				</pc:TextParameter>
			</pc:Parameters>
		</pc:Section>
		<pc:Section>
			<pc:Parameters>
				<pc:IntegerParameter>
					<pc:Name>intNumber3</pc:Name>
					<pc:Label>Liczba całkowita5</pc:Label>
					<pc:Description>Długi opis. Długi opis. Długi opis. Długi opis. Długi opis. Długi opis. Długi opis. Długi opis. Długi opis. Długi opis. Długi opis. Długi opis. Długi opis.</pc:Description>
				</pc:IntegerParameter>
				<pc:FloatParameter>
					<pc:Name>floatNumber4</pc:Name>
					<pc:Label>Liczba zmiennoprzecinkowa</pc:Label>
					<pc:Description>Długi opis. Długi opis. Długi opis. Długi opis. Długi opis. Długi opis. Długi opis. Długi opis. Długi opis. Długi opis. Długi opis. Długi opis. Długi opis.</pc:Description>
					<pc:MinValue>0.5</pc:MinValue>
					<pc:MaxValue>10</pc:MaxValue>
				</pc:FloatParameter>
			</pc:Parameters>
		</pc:Section>
		<pc:Section>
			<pc:Parameters>
				<pc:DateTimeParameter>
					<pc:Name>startDateNumber3</pc:Name>
					<pc:Label>Parametr datowy</pc:Label>
					<pc:Description>Długi opis. Długi opis. Długi opis. Długi opis. Długi opis. Długi opis. Długi opis. Długi opis. Długi opis. Długi opis. Długi opis. Długi opis. Długi opis.</pc:Description>
				</pc:DateTimeParameter>
				<pc:BooleanParameter>
					<pc:Name>boolParameter6</pc:Name>
					<pc:Label>Parametr True/False</pc:Label>
					<pc:Description>To jest szczegółowy opis pola typu TAK/NIE</pc:Description>
				</pc:BooleanParameter>
				<pc:DateTimeParameter>
					<pc:Name>endDateNumber8</pc:Name>
					<pc:Label>Parametr datowy</pc:Label>
					<pc:Description>Długi opis. Długi opis. Długi opis. Długi opis. Długi opis. Długi opis. Długi opis. Długi opis. Długi opis. Długi opis. Długi opis. Długi opis. Długi opis.</pc:Description>
				</pc:DateTimeParameter>
			</pc:Parameters>
			<pc:VisibilityCondition>
				<pc:FirstParameterName>intNumber3</pc:FirstParameterName>
				<pc:Clause>EqualTo</pc:Clause>
				<pc:Value>0</pc:Value>
			</pc:VisibilityCondition>
		</pc:Section>
		<pc:Section>
			<pc:Parameters>
				<pc:EnumerationParameter optional="true">
					<pc:Name>enumParameter9</pc:Name>
					<pc:Label>Parametr wyliczeniowy</pc:Label>
					<pc:Description>Długi opis. Długi opis. Długi opis. Długi opis. Długi opis. Długi opis. Długi opis. Długi opis. Długi opis. Długi opis. Długi opis. Długi opis. Długi opis.</pc:Description>
					<pc:EnumerationList>
						<pc:Item>A</pc:Item>
						<pc:Item>B</pc:Item>
						<pc:Item>C</pc:Item>
					</pc:EnumerationList>
				</pc:EnumerationParameter>
			</pc:Parameters>
		</pc:Section>
		<pc:Section>
			<pc:Parameters>
				<pc:TextParameter>
					<pc:Name>textParameter29</pc:Name>
					<pc:Label>Parametr tekstowy</pc:Label>
					<pc:Description>Długi opis. Długi opis. Długi opis. Długi opis. Długi opis. Długi opis. Długi opis. Długi opis. Długi opis. Długi opis. Długi opis. Długi opis. Długi opis.</pc:Description>
					<pc:RegularExpression>*</pc:RegularExpression>
				</pc:TextParameter>
			</pc:Parameters>
		</pc:Section>
		<pc:Section>
			<pc:Parameters>
				<pc:IntegerParameter>
					<pc:Name>intNumber1</pc:Name>
					<pc:Label>Liczba całkowita</pc:Label>
					<pc:Description>Długi opis. Długi opis. Długi opis. Długi opis. Długi opis. Długi opis. Długi opis. Długi opis. Długi opis. Długi opis. Długi opis. Długi opis. Długi opis.</pc:Description>
				</pc:IntegerParameter>
				<pc:FloatParameter>
					<pc:Name>floatNumber2</pc:Name>
					<pc:Label>Liczba zmiennoprzecinkowa</pc:Label>
					<pc:Description>Długi opis. Długi opis. Długi opis. Długi opis. Długi opis. Długi opis. Długi opis. Długi opis. Długi opis. Długi opis. Długi opis. Długi opis. Długi opis.</pc:Description>
					<pc:MinValue>0.5</pc:MinValue>
					<pc:MaxValue>10</pc:MaxValue>
				</pc:FloatParameter>
			</pc:Parameters>
		</pc:Section>
		<pc:Section>
			<pc:Parameters>
				<pc:DateTimeParameter>
					<pc:Name>startDateNumber36</pc:Name>
					<pc:Label>Parametr datowy</pc:Label>
					<pc:Description>Długi opis. Długi opis. Długi opis. Długi opis. Długi opis. Długi opis. Długi opis. Długi opis. Długi opis. Długi opis. Długi opis. Długi opis. Długi opis.</pc:Description>
				</pc:DateTimeParameter>
				<pc:BooleanParameter>
					<pc:Name>boolParameter4</pc:Name>
					<pc:Label>Parametr True/False</pc:Label>
					<pc:Description>To jest szczegółowy opis pola typu TAK/NIE</pc:Description>
				</pc:BooleanParameter>
				<pc:DateTimeParameter>
					<pc:Name>endDateNumber5</pc:Name>
					<pc:Label>Parametr datowy</pc:Label>
					<pc:Description>Długi opis. Długi opis. Długi opis. Długi opis. Długi opis. Długi opis. Długi opis. Długi opis. Długi opis. Długi opis. Długi opis. Długi opis. Długi opis.</pc:Description>
				</pc:DateTimeParameter>
			</pc:Parameters>
		</pc:Section>
	
	</pc:Sections>
	<pc:ParametersConfiguratorSummary>
Summary
Lorem ipsum dolor sit amet, consectetur adipiscing elit, sed do eiusmod tempor incididunt ut labore et dolore magna aliqua. Ut enim ad minim veniam, quis nostrud exercitation ullamco laboris nisi ut aliquip ex ea commodo
	</pc:ParametersConfiguratorSummary>
</pc:ParametersConfigurator>