<?xml version="1.0" encoding="UTF-8"?>

<pc:ParametersConfigurator
	xmlns:pc="http://www.czadzik.pl/parametersConfigurator" xmlns:xsi="http://www.w3.org/2001/XMLSchema-instance"
	xsi:schemaLocation="http://www.czadzik.pl/parametersConfigurator ../parametersConfigurator.xsd"
	additionalParameters="true">

	<pc:ParametersConfiguratorTitle>Boolean example</pc:ParametersConfiguratorTitle>
	<pc:ParametersConfiguratorIntroduction>
Introduction
Lorem ipsum dolor sit amet, consectetur adipiscing elit, sed do eiusmod tempor incididunt ut labore et dolore magna aliqua. Ut enim ad miur. Excepteur sint occaecat cupidatat non proident, sunt in culpa qui officia deseru
</pc:ParametersConfiguratorIntroduction>
	<pc:Sections>
		<pc:Section>
			<pc:Parameters>
				<pc:BooleanParameter maxNumberOfValues="5" optional="true">
					<pc:Name>boolParameter</pc:Name>
					<pc:Label>Parametr True/False</pc:Label>
					<pc:Description>To jest szczegółowy opis pola typu TAK/NIE</pc:Description>
				</pc:BooleanParameter>
				<pc:IntegerParameter>
					<pc:Name>intNumber</pc:Name>
				</pc:IntegerParameter>
			</pc:Parameters>
		</pc:Section>
	</pc:Sections>
	<pc:CorrectnessConditions>
		<pc:Condition>
			<pc:FirstParameterName>intNumber</pc:FirstParameterName>
			<pc:Clause>IsSubset</pc:Clause>
			<pc:Set>
				<pc:Item>10</pc:Item>
				<pc:Item>12</pc:Item>
				<pc:Item>14</pc:Item>
			</pc:Set>
		</pc:Condition>
		<pc:ConditionalSection logicalConnector="AND">
			<pc:ConditionalSection logicalConnector="OR">
				<pc:Condition>
					<pc:FirstParameterName>boolParameter</pc:FirstParameterName>
					<pc:Clause>==</pc:Clause>
					<pc:Value>True</pc:Value>
				</pc:Condition>
				<pc:Condition>
					<pc:FirstParameterName>boolParameter</pc:FirstParameterName>
					<pc:Clause>==</pc:Clause>
					<pc:Value>True</pc:Value>
				</pc:Condition>
				<pc:Condition>
					<pc:FirstParameterName>boolParameter</pc:FirstParameterName>
					<pc:Clause>==</pc:Clause>
					<pc:Value>True</pc:Value>
				</pc:Condition>
			</pc:ConditionalSection>
			<pc:Condition>
				<pc:FirstParameterName>boolParameter</pc:FirstParameterName>
				<pc:Clause>==</pc:Clause>
				<pc:Value>True</pc:Value>
			</pc:Condition>
			<pc:Condition>
				<pc:FirstParameterName>boolParameter</pc:FirstParameterName>
				<pc:Clause>==</pc:Clause>
				<pc:Value>True</pc:Value>
			</pc:Condition>
			<pc:Condition>
				<pc:FirstParameterName>boolParameter</pc:FirstParameterName>
				<pc:Clause>==</pc:Clause>
				<pc:Value>True</pc:Value>
			</pc:Condition>
		</pc:ConditionalSection>
	</pc:CorrectnessConditions>

	<pc:ParametersConfiguratorSummary>
Summary
Lorem ipsum dolor sit amet, consectetur adipiscing elit, sed do eiusmod tempor incididunt ut labore et dolore magna aliqua. Ut enim ad minim veniam, quis nostrud exercitation ullamco laboris nisi ut aliquip ex ea commodo
</pc:ParametersConfiguratorSummary>
</pc:ParametersConfigurator>