<?xml version="1.0" encoding="UTF-8"?>

<pc:ParametersConfigurator
	xmlns:pc="http://www.czadzik.pl/parametersConfigurator" xmlns:xsi="http://www.w3.org/2001/XMLSchema-instance"
	xsi:schemaLocation="http://www.czadzik.pl/parametersConfigurator ../parametersConfigurator.xsd">

	<pc:ParametersConfiguratorTitle>Float example</pc:ParametersConfiguratorTitle>
	<pc:ParametersConfiguratorIntroduction>
Introduction
Lorem ipsum dolor sit amet, consectetur adipiscing elit, sed do eiusmod tempor incididunt ut labore et dolore magna aliqua. Ut enim ad miur. Excepteur sint occaecat cupidatat non proident, sunt in culpa qui officia deseru
</pc:ParametersConfiguratorIntroduction>
	<pc:Sections>
		<pc:Section>
			<pc:Parameters>
				<pc:FloatParameter minNumberOfValues="4" maxNumberOfValues="10" optional="true">
					<pc:Name>flatParameter</pc:Name>
					<pc:Label>Liczba zmiennoprzecinkowa</pc:Label>
					<pc:MinValue>0.5</pc:MinValue>
					<pc:MaxValue>10</pc:MaxValue>
				</pc:FloatParameter>
			</pc:Parameters>
		</pc:Section>
	</pc:Sections>


	<pc:ParametersConfiguratorSummary>
Summary
Lorem ipsum dolor sit amet, consectetur adipiscing elit, sed do eiusmod tempor incididunt ut labore et dolore magna aliqua. Ut enim ad minim veniam, quis nostrud exercitation ullamco laboris nisi ut aliquip ex ea commodo
</pc:ParametersConfiguratorSummary>
</pc:ParametersConfigurator>