<?xml version="1.0" encoding="UTF-8"?>

<pc:ParametersConfigurator
	xmlns:pc="http://www.czadzik.pl/parametersConfigurator" xmlns:xsi="http://www.w3.org/2001/XMLSchema-instance"
	xsi:schemaLocation="http://www.czadzik.pl/parametersConfigurator ../../parametersConfigurator.xsd">

	<pc:ParametersConfiguratorTitle>Condition Example Date 2</pc:ParametersConfiguratorTitle>
	<pc:Sections>
		<pc:Section>
			<pc:Parameters>
				<pc:DateParameter maxNumberOfValues="1">
					<pc:Name>date1</pc:Name>
				</pc:DateParameter>
				<pc:DateParameter>
					<pc:Name>date2</pc:Name>
				</pc:DateParameter>
				<pc:IntegerParameter>
					<pc:Name>int3</pc:Name>
				</pc:IntegerParameter>
				<pc:DateTimeParameter>
					<pc:Name>dateTime4</pc:Name>
				</pc:DateTimeParameter>
				<pc:TextParameter>
					<pc:Name>text5</pc:Name>
				</pc:TextParameter>
			</pc:Parameters>
		</pc:Section>
		<pc:Section>
			<pc:Parameters>
				<pc:IntegerParameter>
					<pc:Name>date1_Equalto_parameter_date2</pc:Name>
				</pc:IntegerParameter>
			</pc:Parameters>
			<pc:VisibilityCondition>
					<pc:FirstParameterName>date1</pc:FirstParameterName>
					<pc:Clause>==</pc:Clause>
					<pc:SecondParameterName>date2</pc:SecondParameterName>
			</pc:VisibilityCondition>
		</pc:Section>
		<pc:Section>
			<pc:Parameters>
				<pc:IntegerParameter>
					<pc:Name>date1_notEqualto_parameter_int3</pc:Name>
				</pc:IntegerParameter>
			</pc:Parameters>
			<pc:VisibilityCondition>
					<pc:FirstParameterName>date1</pc:FirstParameterName>
					<pc:Clause>!=</pc:Clause>
					<pc:SecondParameterName>int3</pc:SecondParameterName>
			</pc:VisibilityCondition>
		</pc:Section>
		<pc:Section>
			<pc:Parameters>
				<pc:IntegerParameter>
					<pc:Name>date1_GreaterThan_parameter_dateTime4</pc:Name>
				</pc:IntegerParameter>
			</pc:Parameters>
			<pc:VisibilityCondition>
					<pc:FirstParameterName>date1asd</pc:FirstParameterName>
					<pc:Clause>GreaterThan</pc:Clause>
					<pc:SecondParameterName>dateTime4</pc:SecondParameterName>
			</pc:VisibilityCondition>
		</pc:Section>
		<pc:Section>
			<pc:Parameters>
				<pc:IntegerParameter>
					<pc:Name>date1_LessThan_parameter_text5</pc:Name>
				</pc:IntegerParameter>
			</pc:Parameters>
			<pc:VisibilityCondition>
					<pc:FirstParameterName>date1</pc:FirstParameterName>
					<pc:Clause>LessThan</pc:Clause>
					<pc:SecondParameterName>text5</pc:SecondParameterName>
			</pc:VisibilityCondition>
		</pc:Section>
	</pc:Sections>
</pc:ParametersConfigurator>